category_id,sub_category_id,category,sub_category,relation_type,linker
15,22,ELABORATION,SIMILARITY,support,de forma equivalente al
15,23,ELABORATION,SIMILARITY,support,de forma equivalente al hecho de
15,24,ELABORATION,SIMILARITY,support,de forma equivalente al hecho de que
15,25,ELABORATION,SIMILARITY,support,de forma similar a
15,26,ELABORATION,SIMILARITY,support,de forma similar a la
15,27,ELABORATION,SIMILARITY,support,de forma similar a las
15,28,ELABORATION,SIMILARITY,support,de forma similar a los
15,29,ELABORATION,SIMILARITY,support,de forma similar al
15,30,ELABORATION,SIMILARITY,support,de forma similar al hecho de
15,31,ELABORATION,SIMILARITY,support,de forma similar al hecho de que
15,32,ELABORATION,SIMILARITY,support,de igual forma
15,33,ELABORATION,SIMILARITY,support,de igual forma que
15,34,ELABORATION,SIMILARITY,support,de igual manera
15,35,ELABORATION,SIMILARITY,support,de igual manera que
15,36,ELABORATION,SIMILARITY,support,de igual modo
15,37,ELABORATION,SIMILARITY,support,de igual modo que
15,38,ELABORATION,SIMILARITY,support,de la misma forma
15,39,ELABORATION,SIMILARITY,support,de la misma forma que
15,40,ELABORATION,SIMILARITY,support,de la misma manera
15,41,ELABORATION,SIMILARITY,support,de la misma manera que
15,42,ELABORATION,SIMILARITY,support,de manera análoga a
15,43,ELABORATION,SIMILARITY,support,de manera análoga a la
15,44,ELABORATION,SIMILARITY,support,de manera análoga a las
15,45,ELABORATION,SIMILARITY,support,de manera análoga a los
15,46,ELABORATION,SIMILARITY,support,de manera análoga al
15,47,ELABORATION,SIMILARITY,support,de manera análoga al hecho de
15,48,ELABORATION,SIMILARITY,support,de manera análoga al hecho de que
15,49,ELABORATION,SIMILARITY,support,de manera equivalente a
15,50,ELABORATION,SIMILARITY,support,de manera equivalente a la
15,51,ELABORATION,SIMILARITY,support,de manera equivalente a las
15,52,ELABORATION,SIMILARITY,support,de manera equivalente a los
15,53,ELABORATION,SIMILARITY,support,de manera equivalente al
15,54,ELABORATION,SIMILARITY,support,de manera equivalente al hecho de
15,55,ELABORATION,SIMILARITY,support,de manera equivalente al hecho de que
15,56,ELABORATION,SIMILARITY,support,de manera similar a
15,57,ELABORATION,SIMILARITY,support,de manera similar a la
15,58,ELABORATION,SIMILARITY,support,de manera similar a las
15,59,ELABORATION,SIMILARITY,support,de manera similar a los
15,60,ELABORATION,SIMILARITY,support,de manera similar al
15,61,ELABORATION,SIMILARITY,support,de manera similar al hecho de
15,62,ELABORATION,SIMILARITY,support,de manera similar al hecho de que
15,63,ELABORATION,SIMILARITY,support,de modo análogo a
15,64,ELABORATION,SIMILARITY,support,de modo análogo a la
15,65,ELABORATION,SIMILARITY,support,de modo análogo a las
15,66,ELABORATION,SIMILARITY,support,de modo análogo a los
15,67,ELABORATION,SIMILARITY,support,de modo análogo al
15,68,ELABORATION,SIMILARITY,support,de modo análogo al hecho de
15,69,ELABORATION,SIMILARITY,support,de modo análogo al hecho de que
15,70,ELABORATION,SIMILARITY,support,de modo equivalente a
15,71,ELABORATION,SIMILARITY,support,de modo equivalente a la
15,72,ELABORATION,SIMILARITY,support,de modo equivalente a las
15,73,ELABORATION,SIMILARITY,support,de modo equivalente a los
15,74,ELABORATION,SIMILARITY,support,de modo equivalente al
15,75,ELABORATION,SIMILARITY,support,de modo equivalente al hecho de
15,76,ELABORATION,SIMILARITY,support,de modo equivalente al hecho de que
15,77,ELABORATION,SIMILARITY,support,de modo similar a
15,78,ELABORATION,SIMILARITY,support,de modo similar a la
15,79,ELABORATION,SIMILARITY,support,de modo similar a las
15,80,ELABORATION,SIMILARITY,support,de modo similar a los
15,81,ELABORATION,SIMILARITY,support,de modo similar al
15,82,ELABORATION,SIMILARITY,support,de modo similar al hecho de
15,83,ELABORATION,SIMILARITY,support,de modo similar al hecho de que
15,84,ELABORATION,SIMILARITY,support,del mismo modo
15,85,ELABORATION,SIMILARITY,support,del mismo modo que
15,86,ELABORATION,SIMILARITY,support,equivalentemente
15,87,ELABORATION,SIMILARITY,support,equivalentemente a
15,88,ELABORATION,SIMILARITY,support,equivalentemente a la
15,89,ELABORATION,SIMILARITY,support,equivalentemente a las
15,90,ELABORATION,SIMILARITY,support,equivalentemente a los
15,91,ELABORATION,SIMILARITY,support,equivalentemente al
15,92,ELABORATION,SIMILARITY,support,equivalentemente al hecho de
15,93,ELABORATION,SIMILARITY,support,equivalentemente al hecho de que
15,94,ELABORATION,SIMILARITY,support,igualmente
15,95,ELABORATION,SIMILARITY,support,similarmente
15,96,ELABORATION,SIMILARITY,support,similarmente a
15,97,ELABORATION,SIMILARITY,support,similarmente a la
15,98,ELABORATION,SIMILARITY,support,similarmente a las
15,99,ELABORATION,SIMILARITY,support,similarmente a los
15,100,ELABORATION,SIMILARITY,support,similarmente al
15,101,ELABORATION,SIMILARITY,support,similarmente al hecho de
15,102,ELABORATION,SIMILARITY,support,similarmente al hecho de que
16,1,ELABORATION,ADDITION,support,a ello se añade
16,2,ELABORATION,ADDITION,support,a ello se añade el hecho de
16,3,ELABORATION,ADDITION,support,a ello se añade el hecho de que
16,4,ELABORATION,ADDITION,support,a ello se suma
16,5,ELABORATION,ADDITION,support,a ello se suma el hecho de
16,6,ELABORATION,ADDITION,support,a ello se suma el hecho de que
16,7,ELABORATION,ADDITION,support,a eso se añade
16,8,ELABORATION,ADDITION,support,a eso se añade el hecho de
16,9,ELABORATION,ADDITION,support,a eso se añade el hecho de que
16,10,ELABORATION,ADDITION,support,a eso se suma
16,11,ELABORATION,ADDITION,support,a eso se suma el hecho de
16,12,ELABORATION,ADDITION,support,a eso se suma el hecho de que
16,13,ELABORATION,ADDITION,support,a esto se añade
16,14,ELABORATION,ADDITION,support,a esto se añade el hecho de
16,15,ELABORATION,ADDITION,support,a esto se añade el hecho de que
16,16,ELABORATION,ADDITION,support,a esto se suma
16,17,ELABORATION,ADDITION,support,a esto se suma el hecho de
16,18,ELABORATION,ADDITION,support,a esto se suma el hecho de que
16,19,ELABORATION,ADDITION,support,a su vez
16,20,ELABORATION,ADDITION,support,además
16,21,ELABORATION,ADDITION,support,además de
16,22,ELABORATION,ADDITION,support,además de la
16,23,ELABORATION,ADDITION,support,además de las
16,24,ELABORATION,ADDITION,support,además de los
16,25,ELABORATION,ADDITION,support,además del
16,26,ELABORATION,ADDITION,support,además del hecho de
16,27,ELABORATION,ADDITION,support,además del hecho de que
16,28,ELABORATION,ADDITION,support,adicionalmente
16,29,ELABORATION,ADDITION,support,adicionalmente a
16,30,ELABORATION,ADDITION,support,adicionalmente a la
16,31,ELABORATION,ADDITION,support,adicionalmente a las
16,32,ELABORATION,ADDITION,support,adicionalmente a los
16,33,ELABORATION,ADDITION,support,adicionalmente al
16,34,ELABORATION,ADDITION,support,adicionalmente al hecho de
16,35,ELABORATION,ADDITION,support,adicionalmente al hecho de que
16,36,ELABORATION,ADDITION,support,al margen
16,37,ELABORATION,ADDITION,support,al margen de
16,38,ELABORATION,ADDITION,support,al margen de la
16,39,ELABORATION,ADDITION,support,al margen de las
16,40,ELABORATION,ADDITION,support,al margen de los
16,41,ELABORATION,ADDITION,support,al margen del
16,42,ELABORATION,ADDITION,support,al margen del hecho de
16,43,ELABORATION,ADDITION,support,al margen del hecho de que
16,44,ELABORATION,ADDITION,support,al mismo tiempo
16,45,ELABORATION,ADDITION,support,aparte
16,46,ELABORATION,ADDITION,support,aparte de
16,47,ELABORATION,ADDITION,support,aparte del hecho de
16,48,ELABORATION,ADDITION,support,aparte del hecho de que
16,49,ELABORATION,ADDITION,support,asimismo
16,50,ELABORATION,ADDITION,support,así como
16,51,ELABORATION,ADDITION,support,así como el hecho de
16,52,ELABORATION,ADDITION,support,así como el hecho de que
16,53,ELABORATION,ADDITION,support,así mismo
16,54,ELABORATION,ADDITION,support,aún más
16,55,ELABORATION,ADDITION,support,e
16,56,ELABORATION,ADDITION,support,es más
16,57,ELABORATION,ADDITION,support,lo que es más
16,58,ELABORATION,ADDITION,support,más allá de
16,59,ELABORATION,ADDITION,support,más allá de la
16,60,ELABORATION,ADDITION,support,más allá de las
16,61,ELABORATION,ADDITION,support,más allá de los
16,62,ELABORATION,ADDITION,support,más allá del
16,63,ELABORATION,ADDITION,support,más allá del hecho de
16,64,ELABORATION,ADDITION,support,más allá del hecho de que
16,65,ELABORATION,ADDITION,support,más aún
16,66,ELABORATION,ADDITION,support,también
16,67,ELABORATION,ADDITION,support,y
